{
  "schema_version": "1.0",
  "scenario_id": "LI-S05",
  "specification_only": true,
  "runtime_implemented": false,
  "expected_admission": "accepted",
  "expected_label": "review_relevant",
  "required_reason_codes": [
    "period_end_support_gap",
    "unexplained_reversal"
  ],
  "forbidden_reason_codes": [],
  "visible_entry_ids_after_dedup": [
    "JE-001",
    "JE-002"
  ],
  "withheld_entry_ids": [],
  "expected_gross_debits_minor_by_currency": {
    "USD": 500000
  },
  "must_not_claim": [
    "fraud proved",
    "intent established",
    "audit passed",
    "money saved"
  ],
  "human_review_note": "New visible reversal adds context; no intent or actual loss is established."
}
